text,sentiment
shake shake shake shake shake it,neutral
Raining again,neutral
good morning world,positive
i hope that everyone has been having a great week.  let me know if you think im crazy for hating coffee XD.,neutral
back to br,neutral
Time to put the weapons on the charger for the night.  Sleep tight,neutral
Using tiffys computer...it feels different from mine... the touch is different.,neutral
And ... Happy Mother`s Day to all Moms   You sure are the ? heart of mankind.,positive
 Are they both still talking to you then?,neutral
I want Crimson Gem Saga.  I will just go play RF Guerilla demo repeatedly. I (Mission Failed - YOU DIED) so many times from dicking around,neutral
 lol that was a great movie,positive
will b having my last V tomorow   will have2live off of apples n not caffeine ;( n have2cut down on chocolate bye bye chocy,neutral
I was awoken by loud banging and it continues all day  Good thing I got an early rest last night!,neutral
 Let`s go!,neutral
feels really sick.,negative
Hecks yeah. Jandy timsamlake is too rawesome!,positive
**** internet jus cut me off!  was bout 2 shoot sum guys eye out  ~*~KANDI~*~,negative
 u don`t have school today????,neutral
Not only has it broken but it`s Monday!!Does this mean Monday can be fix`d?  ? http://blip.fm/~5jgio,negative
People at work are stressing me out.,negative
 rt i have had few hearts the past few days on etsy  boo hoo....totally the same for me too ((((((,neutral
love it when my sister brags! but she`s too tired too spell bowling right! haha its ok I <3 her!!,neutral
never trust someone else`s battery operated power tools when you`re in a hurry,positive
 Lol Your tweets are so funny! I met you in Calgary! You`re awesome  Can`t wait for the next HP movie!,positive
is off to work ... still 'recovering' from an amazing and beautiful weekend. Have I mentioned how incredible my friends are??,positive
 so`s the smell of cigarettes and alcohol... at least *i * like it.,positive
All done. No more internship.,neutral
RIP to officer Edwards. May GOD continue to bless his family. What`s up wit cops killing cops. Seen the same thing happen on 'The WIRE'.,neutral
"Invasion of the Old Ladies has just ended, still have to clean up not going to be able to make it to the tweetup tonight.",neutral
`s current goal is to lose 10 pounds by next tuesday! 120 here i come   soooo ready for Gatlinburg!,positive
my best friends bought something which i really want.,positive
" It depends on your goals & how much you want to spend  Cannondale, Specialized and Cervelo are all good brands.",positive
On the phone to mum  http://tinyurl.com/otdn9u,neutral
 me tooo,neutral
My net died so yeah....  I`m sad now,negative
 then am anticipating the next ten days!,neutral
i dont know why i follow sme of the ppl that i do... they e anoying and boring. * note to self -unfollow peeps on monday morning,negative
